Proyecto,Entidad,Estado,Fecha_Actualizacion ,Sponsor,Equipo,Objetivo,Dolores,Riesgos,Impacto Esperado KPIs,Impacto Generado KPIs,RoadMap y entregables,Observaciones,Solucion
Churn Libranzas - POP,Banco Popular,Seguimiento,08/09/2025,"Heidy Botero – Director CM, Omar Triana",Fabian Lara – Luisa Torres,"Detección temprana de clientes con producto Libranzas propensos a prepagar cartera en los siguientes 3 meses, con el fin de realizar campañas preventivas de retención.","Ausencia de campañas de retención dirigidas, actualmente se incluyen un porcentaje de clientes (no el total de clientes en estrategia alta, deciles 7, 8 y 9) en campañas de novacion.",Envio de fuentes externas del banco: Huellas. Cambio en las fuentes de productos del activo.,"Evaluar tratamiento vs control: - Disminucion de la tasa de Churn - Renovacion de Libranza. Métricas Técnicas: AUC: 66.56%, KS: 23.57%, Recall: 52.95%, Reduccion tasa de Churn 1.8%",Reducción del 12% de la tasa de churn de 1.42% a 1.27% medida en piloto a traves de la comparación con grupo de control.,"Fase 1: Definición y Desarrollo, Fase 2: Piloto, Fase 3: Automatización y Operativización, Fase 4: Seguimiento y Recalibración",Calibracion modelo y Piloto: retiro de variable Huellas y nueva campaña de retención Marzo 2024,"Modelo ML Supervisado (XGBoost) con el objetivo de pronosticar Churn o decrecimiento de saldo>80% en los siguientes 3 meses en el producto libranzas, para identificar clientes con alta propensión. Estrategia alta: 3 últimos deciles."
Retención Cliente - POP,Banco Popular,Operativización,08/09/2025,Daniel Bobadilla/Monica Bernal - Gerencia De Segmentos Y Canales,Fabian Lara y Ana Urcuqui,"Impulsar un proceso de retención proactivo a nivel cliente apalancado en analítica avanzada para pronosticar deserción en los diferentes segmentos del banco, con el fin de cambiar la estrategia y migrar de visión producto a nivel cliente.","El principal dolor radica en la ausencia de empoderamiento por parte de los dueños de cada producto involucrado, pues sin uso no se han podido realizar mediciones constantes. (Falta de priorización del caso). A lo largo del caso: Aceptación de BAU referentes a datos solicitadas en la mesa: Análisis cruzados de PQR's con salidas del caso, Análisis de la contribución de clientes a grupos específicos, generación de cifras según definición churn a corto plazo del banco, generación de bases con estructuras definidas para mdm, entrega de bases con campos solicitados. Que finalmente no generan valor.","Cambios en las fuentes mdm, que impacten la volumetría de las mdt.","La medición se diseña a partir de campañas de retención centradas en destacar al cliente de características relevantes de sus productos. (Responsys), •Tasa de Churn (efectividad modelo). •Funnel Comunicación (efectividad estrategia). Métricas Técnicas: Ahorros(AUC: 0.962, Precision: 0.812, Recall: 0.811, F1: 0.812, Accuracy: 0.933), CDT(AUC: 0.801, Precision: 0.788, Recall: 0.969, F1: 0.855, Accuracy: 0.787), Corriente(AUC: 0.94, Precision: 0.77, Recall: 0.782, F1: 0.776, Accuracy: 0.918), TDC-Tradicional(AUC: 0.914, Precision: 0.855, Recall: 0.735, F1: 0.79, Accuracy: 0.882), TDC-Expres(AUC: 0.908, Precision: 0.825, Recall: 0.772, F1: 0.798, Accuracy: 0.85)",Resultados de los pilotos se miden comparando grupo tratamiento - control de la tasa de churn sobre los clientes finalmente contactables en el funnel de comunicación: En promedio en los diferentes productos se observó una disminución del 15% en la tasa de churn.,"Fase 1: Definición Estrategia y Enfoque Analítico, Fase 2: Fase Monoproducto, Fase 3: Fase Multiproducto, Fase 4: Operativización",Usos parciales de las salidas: Campañas focalizadas en clientes top haciendo un trato diferencial por parte de segmento y experiencia marca.,Matriz de Priorización de la estrategia focalizada en aquellos clientes que son de alto valor para el banco y tienen alta probabilidad de dejar el banco.
Aumento uso TDC - POP,Banco Popular,Cerrado,11/09/2025,David Ortiz - Gerencia De Productos De Consumo Y Captación,Katherin Quiñonez - Leandro Sánchez,Estimular el incremento de uso de los cupos actuales (Clientes activos) y reactivación de los clientes durmientes (Clientes sin uso de TC).,"1. Falta de confirmación en la ejecución de toques por Responsys: Uno de los principales dolores fue la imposibilidad de verificar que las interacciones programadas a través de Responsys se estuvieran realizando conforme a lo acordado y en las fechas establecidas. A pesar de haber solicitado seguimiento en múltiples ocasiones, no se obtuvo respuesta por parte del equipo responsable. 2. Conciliación de cifras en el tablero de seguimiento de campaña: Se identificaron inconsistencias en los datos reportados, lo que requirió una revisión exhaustiva del flujo de información. Durante este proceso se detectaron múltiples errores que afectaban la confiabilidad del tablero. 3. Definición de una medición adecuada del caso de negocio: La metodología que se usó para medir durmientes no era favorable con el modelo.",Confirmación de toques en campaña según lo acordado. Definición de público objetivo.,"Métricas Técnicas: Tasa V.O : 3.1%, PSI: 0.1, Estadístico Kolmogorov-Smirnov (KS-test): 61%, Área bajo la curva ROC (AUC): 86.4%, Precisión (Precision): 25%, Sensibilidad (Recall): 60%. Activos: Oro(Express: 70.1% efectividad/Doble puntos, La 14: 89.1% efectividad/Informativo, Tradicional: 31.5% efectividad/Informativo), Plata(Express: 37.9% efectividad/Doble puntos, La 14: 59.5% efectividad/Doble puntos, Tradicional: 14.5% efectividad/Informativo). Durmientes: Express(Estratégico: Doble puntos/6,6% margen, Popular: Doble puntos/14,6% margen, Siempre se puede: Doble puntos/581,3% margen), La 14(Estratégico: Tasa diferencial/10,5% margen), Tradicional(Fan: Doble puntos/43,5% margen, Fan: Tasa diferencial/117,1% margen, Popular: Tasa diferencial/34,2% margen, Siempre se puede: 4000 puntos/55,6% margen).","Activos: Oro(Express: 39.45% efectividad/Doble puntos, La 14: 28.35% efectividad/Informativo, Tradicional: 35.72% efectividad/Informativo), Plata(Express: 15.05% efectividad/Doble puntos, La 14: 7.77% efectividad/Doble puntos, Tradicional: 18.29% efectividad/Informativo). Durmientes: Express(Estratégico: Doble puntos/6,92% margen, Popular: Doble puntos/7,75% margen, Siempre se puede: Doble puntos/40,82% margen), La 14(Estratégico: Tasa diferencial/8,71% margen, Fan: Doble puntos/52,26% margen, Fan: Tasa diferencial/44,71% margen), Tradicional(Popular: Tasa diferencial/15,93% margen, Siempre se puede: 4000 puntos/33% margen).","Fase 1: Selección casod e uso, Fase 2: Pilotaje, Fase 3: Automatización Augusta, Fase 4: Operativización y seguimiento, Documentación cierre",Caso en proceso de cierre,"Estimular el uso de cupos disponibles por parte de clientes existentes, a través de un sistema de recomendación basado en agrupamiento (clustering) y descomposición en valores singulares (SVD), que sugiere tres categorías de compra relevantes. Activar y reactivar clientes inactivos o 'durmientes' mediante un modelo XGBoost de clasificación que prioriza la gestión del decil superior, según la probabilidad de respuesta o conversión."
Ecosistema Pensionados,Banco Popular,Desarrollo,08/09/25,Laura Álvarez Castro – Directora de Ecosistema Digital Silver,Katherine Quiñones - Camilo Jimenez - Andrés Ortiz,"General: Ofrecer soluciones a las necesidades de la población de 50+ (llamada “Silver”) a través de un ecosistema híbrido. Esto se logra mediante la asistencia física y digital, proporcionada por los “Asistentes Mijo”. Específico AA: Construcción del asistente digital Mijo mediante IA Generativa.","- A pesar de los múltiples desarrollos hechos, no hay un canal ágil y claro para que el cliente inicie con la interacción con el bot en test, para una certificación rápida y personalizada.","Proceso de webscrapping puede requerir un nivel especializado de desarrollo, que incluyen temas de seguraridad.","El bot hace parte de una solución integral donde se esperan cumplir estos KPIs: En el primer mes tener 6.500 usuarios registrados. 3.600 interacciones con asistentes mijo (físico o virtual) en el primer mes. Se tendrán encuestas de satisfacción de las respuestas dadas por el bot. Métricas Técnicas: Context Relevance, Faithfulness",,"Fase 1: MVP1 módulo Salud financiera, Fase 2: Integración Canales WA y Portal, Fase 3: MVP2 Todos los módulos, Fase 4: Entrega Final y evolutivos a definir",,"Desarrollo a través de IA Generativa, de un asistente digital llamado Mijo que responderá a preguntas sobre consejos financieros, salud y bienestar, formación, crecimiento y entretenimiento para la población 50+"
Ecosistemas empresas - POP,Banco Popular,Bloqueado / Automatizacion,08/09/2025,Roberto Barrios - BI Empresas y Gobierno,Luis Felipe Lujan – Luisa Torres,"Capturar flujo de capital fuga desde clients persona jurida que estan activos transaccionalmente en ecosistemas donde participant cuentas maestras, con el fin de habilitar ofertas de originacion o xsell",Priorización,Logo,"% de clientes gestionados, % clientes con cierre de negocio (nuevos productos), Aumento saldo de depósitos, Disminución % saldo fugado. Métricas Técnicas: Disminución de saldo fugado de actores priorizados y relacionados transaccionales. Métricas de estabilidad para garantizar volúmenes de gestión trimestral en la fuerza comercial.",,"Fase 1: Definición y Desarrollo, Fase 2: Piloto y Refinamiento, Fase 3: Automatización y Operativización, Fase 4: Seguimiento y Recalibración",Logo,"Algoritmo basado en teoría de grafos, que busca identificar interacciones transaccionales relevantes dentro de ecosistemas donde participan Cuentas Maestras del Gobierno, a partir de la frecuencia, intensidad y peso de la interacción con otros actores."
AIGen PQRS,Banco Popular,Desarrollo,09/09/2025,Fernando Fernandez,Mateo Restrepo,"Uso De IA Generativa para clasificación de diferentes tipologías, resumen del PQRS, extracción y estructuración de información relevante dentro del texto y en los casos donde sea posible redacción de la respuesta directa.","Accenture a presentado más de 4 meses de demora en la integración de los servicios necesarios para generar la respuesta, por eso no hemos podido pasar a un ambiente de pruebas real",Accenture presenta problemas recurrentes y se demora mucho en resolverlos,"Disminución de tiempo de respuesta en PQRS de 3 tipologías : pasar de 9,5 días a 10 minutos Aumento de cantidad de PQRS Respondidos: se espera generar más repuesta por día. Métricas Técnicas: Porcentaje precisión respuesta generada: POR ESTIMAR, Porcentaje precisión extracción información : 100%, Porcentaje precisión tipificación tipología PQRS: 95%",.Disminución de tiempo de respuesta en PQRS: POR ESTIMAR Aumento de cantidad de PQRS Respondidos : POR ESTIMAR,"Fase 1: Desarrollo, Fase 2: Piloto, Fase 3: productivo",Ninguna,"API Modelo Tipología: Proceso de tipificación de PQRS (175 posibles resultados entre motivo y sub-motivo). API Modelo Extracción: Se centra en poder extraer y estructurar la información asociada al contenido radicado al PQRS. Se identifican los campos: tipo de producto, id de producto, monto, fecha y lugar,usando extracción de datos con formato estructurado. API Modelo Respuesta: Genera respuestas sugeridas del PQRS, dependiendo del Motivo y Sub-Motivo y la información resultante de llevar a cabo todo el flujo (Modelo Tipología, Modelo extracción) usando RAG y reglas para generar repuesta"
NBA - Vision Cliente - POP,Banco Popular,Desarrollo,09/09/2025,Niny Johana Chiguazuque Pulido,"Fabian Lara, Heidy Garzon, Daniel Lancheros y Carlos López","Determinar la siguiente mejor acción en clientes naturales existentes activos del banco popular contribuyendo a la profundización del cliente en productos, servicios y uso de canales.",Se quiere aumentar el desembolso de productos y mejorar en fondeo de la entidad (Por lo que se priorizaron los productos del pasivo).,Campañas no rentables y poco efectivas. Costo de fondeo elevado. No cumplir metas de desembolso,"Generar un mayor número de aperturas para los productos asociados al caso. Métricas Técnicas: CDT(Recall: 75.6%, F1: 15.3%), CA-Activo(Recall: 55.43%, F1: 40.64%), CA-Pasivo(Recall: 60.38%, F1: 48.13%)",*Piloto CDT (Oct 2025) Mejora Control VS Tratamiento 3.6X. *CA Saldo (Abril 2025) Mejora Control VS Tratamiento 1.4X *Canal Tradicional.,"Fase 1: Desarrollo, Fase 2: Piloto, Fase 3: productivo","Definición de atribución, es complicado sobre todo en Mathilde. El proceso de modelado es desafiante debido a bajas tasas de las variables objetivo.","Desarrollar modelos estadísticos que permitan estimar la propensión de los clientes a aperturar determinado producto, para después tener una vision a nivel cliente. Automatización y operativización: CA Saldo, CDT. Próximos pilotos: CA Aperturas. Desarrollo: Libranzas y TC. Proximos productos según priorización: Domiciliación."
Cobranzas Cartera Castigada BdB,Banco de Bogotá,Automatización,11/09/25,"Alejandro Figueroa, Claudia Salas","Luis Luján, Julio Antonino Zainea","Optimizar la gestión de cartera no judicializada (Comercial, Consumo y PN) mediante un modelo predictivo que estime la probabilidad de recuperación, permitiendo repriorizar asignaciones",La falta de priorización basada en datos y la limitada trazabilidad sobre la gestión de clientes para la recuperación de saldos.,"No existe visibilidad suficiente sobre cómo se están gestionando los clientes asignados, lo que dificulta el seguimiento efectivo","recuperación (% capital recuperado en los siguientes 3 meses), contactabilidad (% de clientes contactados). Métricas Técnicas: Segmento Bajo(Ks: 54%, Roc: 84%, Precisión: 70%, Recall: 45%, F1: 55%), Segmento Medio(Ks: 63%, Roc: 89%, Precisión: 9,3%, Recall: 61%, F1: 16%), Segmento Alto(Ks: 48%, Roc: 83%, Precisión: 9,8%, Recall: 55%, F1: 16%)",Aumento tasa de recuperación en 20% de clientes priorizados según probabilidad vs clientes con gestión tradicional. 28K millones adicionales de recaudo (VPN a 3 años),"Fase 1: Desarrollo, Fase 2: Pruebas, Fase 3: Automatización, Fase 4: Entrega entidad",,"Se implementa un modelo predictivo para segmentar clientes castigados, estimando la probabilidad de recuperar al menos el 1% del capital en tres meses, dependiendo el segmento."
